{
 "version": "baseline-v1",
 "purpose": "S3 の基準モデル(評価器の検証と、本番の版の比べる相手)。この版自体は段階2→3の判定に使わない",
 "model": "大村の構築期間の起点の単純な発生率(全レース同じ確率)。動き・STもコースごとの単純な割合・平均",
 "frozen_at": "2026-10-07T07:10:45+00:00",
 "built_from": {
  "data": "kyotei_mark1/data/results_all.jsonl・data/judge/[ab]_*.json(後のファイル優先)",
  "period": "20260702〜20260831(起点・動き 309 レース)、ST は 20251215〜20260831",
  "labels": "labels/soft-v1.json"
 },
 "eval_from": null,
 "origin_classes": [
  "2まくり",
  "3まくり",
  "4まくり",
  "5まくり",
  "6まくり",
  "3まくり差し",
  "その他"
 ],
 "bands": {
  "lo": 0.0,
  "hi": 1.01
 },
 "bands_method": "全レース同じ確率のため帯を分けない(全レース○)",
 "success_definition": null,
 "escape_definition": null,
 "soft_label_table": "labels/soft-v1.json",
 "entry": "models/baseline_v1.py",
 "code_files": [
  "models/baseline_v1.py"
 ],
 "code_files_hash": "sha256:77e10508d9d3d44f2884545c9da62704600532048c5c327ac8859bac9f09bcfd",
 "notes": [
  "評価期間(2026-09-01〜10-01)は作るときに見ていない(設計書5.3)",
  "成功確率・1号艇・足の評価は出さない(null)"
 ]
}
